<?xml version="1.0" encoding="UTF-8" ?>
<schema xmlns="http://www.w3.org/2001/XMLSchema"
        targetNamespace="schemeToBeans.jd02_09.markelov.it.by"
        xmlns:tns="schemeToBeans.jd02_09.markelov.it.by"
        elementFormDefault="qualified">

    <element name="clients">
        <complexType>
            <sequence>
                <element name="client"
                         type="tns:client"
                         maxOccurs="unbounded"/>
            </sequence>
        </complexType>
    </element>


    <complexType name="client">
        <sequence>
            <element name="e-mail" type="string"/>
            <element name="login" type="string"/>
            <element name="password" type="string"/>
            <element name="orders" type="tns:Orders"/>
        </sequence>
    </complexType>

    <complexType name="Orders">
        <sequence>
            <element name="order"
                     type="tns:Order"
                     minOccurs="0"
                     maxOccurs="unbounded"/>
        </sequence>
    </complexType>


    <complexType name="Order">
        <sequence>
            <element name="name" type="string"/>
            <element name="code" type="string"/>
            <element name="size" type="string"/>
            <element name="colour" type="string"/>
            <element name="delivery_address" type="string"/>
            <element name="phone_number" type="string"/>
        </sequence>
    </complexType>
</schema>