<?xml version="1.0" encoding="utf-8"?>

<clients xmlns:xsi="http://www.w3.org/2001/XMLSchema-instance"
xsi:schemaLocation="D:\JD2018-11-13\src\by\it\markelov\jd02_07\clients.xml clients.xsd"
xmlns="D:\JD2018-11-13\src\by\it\markelov\jd02_07\clients.xml">
    <client>
        <e-mail>S_markelov@tut.by</e-mail>
        <login>S_markelov</login>
        <password>12345678</password>
        <orders>
            <order>
                <name>sneakers</name>
                <code>20681</code>
                <size>42</size>
                <colour>green</colour>
                <delivery_address>Minsk, Belskogo, 27-79</delivery_address>
                <phone_number>(29)715-97-50</phone_number>
            </order>
            <order>
                <name>shoes</name>
                <code>14205</code>
                <size>42</size>
                <colour>brown</colour>
                <delivery_address>Minsk, Belskogo, 27-79</delivery_address>
                <phone_number>(29)715-97-50</phone_number>
            </order>
        </orders>
    </client>
</clients>